nombre,precio,categoria
Huevos Blancos Grandes Norteño 12 Und/Paq,RD$104.95,Supermercado > Huevos
Huevos Blancos Xl Norteño 18 Und/Paq,RD$169.95,Supermercado > Huevos
Huevos Blancos Lider 30 Und/Paq,RD$214.95,Supermercado > Huevos
Jamón Keto  Don Pedro 32 Onz,RD$429.95,Supermercado > Embutidos y Charcutería
AGREGAR A LISTA,Precio no disponible,Supermercado > Embutidos y Charcutería
Pechuga de Pavo Mesquite Butterball Lb,RD$589.95,Supermercado > Embutidos y Charcutería
"Jamon Cocido Nacional, Lb",RD$289.95,Supermercado > Embutidos y Charcutería
Snack De Fuetc El Pozo 70 Gr.,RD$169.95,Supermercado > Embutidos y Charcutería
Jamón Serrano En Taquitos El Pozo 65 Gr.,RD$249.95,Supermercado > Embutidos y Charcutería
Jamón Ibérico En Lascas El Pozo 750 Gr.,"RD$4,399.95",Supermercado > Embutidos y Charcutería
Jamón Ibérico Lascas El Pozo 80 Gr.,RD$449.95,Supermercado > Embutidos y Charcutería
Jamón Snack Pack Happy Cow 8 Und/Paq,RD$119.95,Supermercado > Embutidos y Charcutería
Codillos De Jamón Curado ElPozo 1 Kg,RD$219.95,Supermercado > Embutidos y Charcutería
Salchichon Iberico Loncheado ElPozo 75 Gr,RD$239.95,Supermercado > Embutidos y Charcutería
Jamón Bolo Líder Lb,RD$259.95,Supermercado > Embutidos y Charcutería
Jamon Cocido Sin Gluten Y Sin Sal ElPozo BienStar 340 Gr,RD$299.95,Supermercado > Embutidos y Charcutería
"Jamón Cocido En Su Jugo Receta Original ElPozo, Lb",RD$369.95,Supermercado > Embutidos y Charcutería
"Jamón De Pechuga De Pollo Sin Gluten ElPozo BienStar, Lb",RD$319.95,Supermercado > Embutidos y Charcutería
Jamón York Rebanado Sosua 3/4 Lb,RD$194.95,Supermercado > Embutidos y Charcutería
"Jamón Picnic Cocido Líder, Lb",RD$199.95,Supermercado > Embutidos y Charcutería
Jamón De Pavo Rebanado Checo 3/4 lB,RD$324.95,Supermercado > Embutidos y Charcutería
Jamonada Estelar Lb,RD$99.95,Supermercado > Embutidos y Charcutería
Jamón Picnic Mixto Checo 340 Gr,RD$168.95,Supermercado > Embutidos y Charcutería
Jamón Picnic Prensado Ahumado Chef Lb,RD$224.95,Supermercado > Embutidos y Charcutería
Pechuga Pavo Sin Gluten Bienestar El Pozo 340 Gr,RD$299.95,Supermercado > Embutidos y Charcutería
Prosciutto Fratelli Beretta Loncheado 4 Onz,RD$349.95,Supermercado > Embutidos y Charcutería
Jamón Ahumado 1954 Lb Elpozo,RD$419.95,Supermercado > Embutidos y Charcutería
"Jamón Cocido 1954 Elpozo, Lb",RD$399.95,Supermercado > Embutidos y Charcutería
Jamón Legado Ibérico Selección El Pozo 60 Gr,RD$369.95,Supermercado > Embutidos y Charcutería
"Pechuga De Pavo Ahumada Elpozo Edicion 1954, Lb",RD$399.95,Supermercado > Embutidos y Charcutería
"Jamón De Muslo De Pavo Elpozo, Lb",RD$389.95,Supermercado > Embutidos y Charcutería
"Jamón Cocido Reducido En Sal Elpozo Bienstar, Lb",RD$374.95,Supermercado > Embutidos y Charcutería
"Pechuga De Pavo Horneada Butterball, Lb",RD$554.95,Supermercado > Embutidos y Charcutería
Jamon York Sosua Lb,RD$218.95,Supermercado > Embutidos y Charcutería
Jamón Keto  Don Pedro 32 Onz,RD$429.95,Supermercado > Jamones Cocidos y Curados
AGREGAR A LISTA,Precio no disponible,Supermercado > Jamones Cocidos y Curados
Pechuga de Pavo Mesquite Butterball Lb,RD$589.95,Supermercado > Jamones Cocidos y Curados
"Jamon Cocido Nacional, Lb",RD$289.95,Supermercado > Jamones Cocidos y Curados
Snack De Fuetc El Pozo 70 Gr.,RD$169.95,Supermercado > Jamones Cocidos y Curados
Jamón Serrano En Taquitos El Pozo 65 Gr.,RD$249.95,Supermercado > Jamones Cocidos y Curados
Jamón Ibérico En Lascas El Pozo 750 Gr.,"RD$4,399.95",Supermercado > Jamones Cocidos y Curados
Jamón Ibérico Lascas El Pozo 80 Gr.,RD$449.95,Supermercado > Jamones Cocidos y Curados
Jamón Snack Pack Happy Cow 8 Und/Paq,RD$119.95,Supermercado > Jamones Cocidos y Curados
Codillos De Jamón Curado ElPozo 1 Kg,RD$219.95,Supermercado > Jamones Cocidos y Curados
Salchichon Iberico Loncheado ElPozo 75 Gr,RD$239.95,Supermercado > Jamones Cocidos y Curados
Jamón Bolo Líder Lb,RD$259.95,Supermercado > Jamones Cocidos y Curados
Jamon Cocido Sin Gluten Y Sin Sal ElPozo BienStar 340 Gr,RD$299.95,Supermercado > Jamones Cocidos y Curados
"Jamón Cocido En Su Jugo Receta Original ElPozo, Lb",RD$369.95,Supermercado > Jamones Cocidos y Curados
"Jamón De Pechuga De Pollo Sin Gluten ElPozo BienStar, Lb",RD$319.95,Supermercado > Jamones Cocidos y Curados
Jamón York Rebanado Sosua 3/4 Lb,RD$194.95,Supermercado > Jamones Cocidos y Curados
"Jamón Picnic Cocido Líder, Lb",RD$199.95,Supermercado > Jamones Cocidos y Curados
Jamón De Pavo Rebanado Checo 3/4 lB,RD$324.95,Supermercado > Jamones Cocidos y Curados
Jamonada Estelar Lb,RD$99.95,Supermercado > Jamones Cocidos y Curados
Jamón Picnic Mixto Checo 340 Gr,RD$168.95,Supermercado > Jamones Cocidos y Curados
Jamón Picnic Prensado Ahumado Chef Lb,RD$224.95,Supermercado > Jamones Cocidos y Curados
Pechuga Pavo Sin Gluten Bienestar El Pozo 340 Gr,RD$299.95,Supermercado > Jamones Cocidos y Curados
Prosciutto Fratelli Beretta Loncheado 4 Onz,RD$349.95,Supermercado > Jamones Cocidos y Curados
Jamón Ahumado 1954 Lb Elpozo,RD$419.95,Supermercado > Jamones Cocidos y Curados
"Jamón Cocido 1954 Elpozo, Lb",RD$399.95,Supermercado > Jamones Cocidos y Curados
Jamón Legado Ibérico Selección El Pozo 60 Gr,RD$369.95,Supermercado > Jamones Cocidos y Curados
"Pechuga De Pavo Ahumada Elpozo Edicion 1954, Lb",RD$399.95,Supermercado > Jamones Cocidos y Curados
"Jamón De Muslo De Pavo Elpozo, Lb",RD$389.95,Supermercado > Jamones Cocidos y Curados
"Jamón Cocido Reducido En Sal Elpozo Bienstar, Lb",RD$374.95,Supermercado > Jamones Cocidos y Curados
"Pechuga De Pavo Horneada Butterball, Lb",RD$554.95,Supermercado > Jamones Cocidos y Curados
Jamon York Sosua Lb,RD$218.95,Supermercado > Jamones Cocidos y Curados
Salami Sticks Citterio 2 Onz,RD$159.95,Supermercado > Salami Cocido y Curado
AGREGAR A LISTA,Precio no disponible,Supermercado > Salami Cocido y Curado
Salami Super Especial Naranjal 1.4 Lb,RD$139.95,Supermercado > Salami Cocido y Curado
Salami Extra Premium Jumbo 1 Lb,RD$178.95,Supermercado > Salami Cocido y Curado
Salami Extra Premium Jumbo 2 Lb,RD$339.95,Supermercado > Salami Cocido y Curado
Fuetec Iberico ElPozo 150 Gr,RD$239.95,Supermercado > Salami Cocido y Curado
Salami Cocido Premium Pequeño Chef,RD$197.95,Supermercado > Salami Cocido y Curado
Salami Super Especial Lider 2 Lb,RD$234.95,Supermercado > Salami Cocido y Curado
Salami Super Especial Lider 1 Lb,RD$119.95,Supermercado > Salami Cocido y Curado
Salami Memorial Don Pedro 2 Lb,RD$384.95,Supermercado > Salami Cocido y Curado
Pepperoni Rebanado Chef 8 Oz,RD$199.95,Supermercado > Salami Cocido y Curado
Pepperoni Rebanado Don Pedro 4 Onz,RD$184.95,Supermercado > Salami Cocido y Curado
Salami Génova Sosua Gold 3 Lb,RD$449.95,Supermercado > Salami Cocido y Curado
Salami Génova Sosua Gold 1.5 Lb,RD$209.95,Supermercado > Salami Cocido y Curado
Salami Super Especial Sosua 2.5 Lb,RD$324.95,Supermercado > Salami Cocido y Curado
Salami Super Especial Sosua 1.5 Lb,RD$199.95,Supermercado > Salami Cocido y Curado
Salami Keto Don Pedro 2 Lb,RD$489.95,Supermercado > Salami Cocido y Curado
Salami Cuadrado Hugo Pork 1.5 Lb,RD$328.95,Supermercado > Salami Cocido y Curado
Salami Cuadrado Hugo Pork 1 Lb,RD$224.95,Supermercado > Salami Cocido y Curado
Salami De Pavo Caserio Pequeño 1 Lb,RD$189.95,Supermercado > Salami Cocido y Curado
Salami Nostrano Beretta 8 Onz,RD$339.95,Supermercado > Salami Cocido y Curado
Salami Sabor Tradicional Elpozo Lb,RD$489.95,Supermercado > Salami Cocido y Curado
Fuet Casero Elpozo 170 Gr,RD$199.95,Supermercado > Salami Cocido y Curado
Fuet Nobleza Elpozo 200 Gr,RD$189.95,Supermercado > Salami Cocido y Curado
"Salami Genoa Fratelli Beretta, Lb",RD$389.95,Supermercado > Salami Cocido y Curado
Salami De Pollo Induveca Mediano,RD$224.95,Supermercado > Salami Cocido y Curado
Salami Supremo Don Pedro Grande,RD$794.95,Supermercado > Salami Cocido y Curado
Salami Supremo Don Pedro Pequeño,RD$307.95,Supermercado > Salami Cocido y Curado
Salami Almirante Don Pedro Grande,RD$409.95,Supermercado > Salami Cocido y Curado
Salami Tipo Argentino Grande Estelar,RD$374.95,Supermercado > Salami Cocido y Curado
Salami Genoa Don Pedro Rebanado 4 Oz,RD$149.95,Supermercado > Salami Cocido y Curado
"Pollo Entero Fresco, Lb",RD$79.00,Automóvil
AGREGAR A LISTA,Precio no disponible,Automóvil
"Pollo Entero Congelado, Lb",RD$74.95,Automóvil
Pierna De Cerdo Lb,RD$124.95,Automóvil
"Paleta De Cerdo, Lb",RD$119.95,Automóvil
Pierna de Cerdo,RD$124.95,Automóvil
Pavo Congelado Butterball 16-18 Lbs,RD$184.95,Automóvil
"Pierna de Cerdo Asada Congelada, Lb",RD$269.95,Automóvil
Pavo Congelado 10-16 Lbs,RD$109.95,Automóvil
"Muslo de Pavo, Lb",RD$116.95,Automóvil
Pechuga De Pavo Entera 4-8 Lbs,RD$284.95,Automóvil
"Pavo Ahumado Butterball, Lb",RD$259.95,Automóvil
"Pollo Entero Congelado Yaque, Lb",RD$74.95,Automóvil
Carne Molida Black Angus Rastelli’s Paq. (Peso Aprox. 1 Libra),RD$429.95,Automóvil
Carne Molida Wagyu Rastelli’s Paq. (Peso Aprox. 1 Libra),RD$549.95,Automóvil
Carne Para Hamburguesas Angus Rastelli´s 6 Und/Paq,RD$979.96,Automóvil
"Alas de Pollo Congeladas Yaque, Lb",RD$128.95,Automóvil
Escalopines de Pollo al pesto Lb,RD$264.95,Automóvil
Hamburguesa de Ternera Lb,RD$289.95,Automóvil
"Churrasco De Cerdo, Lb",RD$279.95,Automóvil
"Alas De Pollo Organicas Congeladas Bell & Evans, Lb",RD$479.95,Automóvil
"Nuggets De Pavo, Lb",RD$349.95,Automóvil
Hamburguesas Pavo Butterball 32 Oz,RD$969.96,Automóvil
"Muslo Largo De Pollo Orgánico Congelado Bell & Evans, Lb",RD$379.95,Automóvil
Pulled Beef Angus Brisket Cuatro Patas 12 Onz,RD$589.95,Automóvil
Gallinita Kiki 20 Onz,RD$379.95,Automóvil
Pulled Pork Cuatropatas 16 Onz.,RD$399.95,Automóvil
"Mix Caldo De Pollo Free Farm, Lb",RD$99.95,Automóvil
"Philly Steak Certified Angus Beef, Lb",RD$399.95,Automóvil
Pollo Entero Free Farm Lb,RD$189.95,Automóvil
Hamburguesa De Res Super Yoyo's 4 Und/Paq,RD$749.96,Automóvil
Vinagre Blanco Ponti 500 Ml,RD$122.95,Automóvil > SUPERMERCADOS NACIONAL
Ofertas exclusivas 1,Precio no disponible,Automóvil > SUPERMERCADOS NACIONAL
Detergente En Polvo Multiusos Lider 5 Lb,RD$164.95,Automóvil > SUPERMERCADOS NACIONAL
Queso Cheddar Mild Cornershop Lb (Peso Aprox. 1 Libra),RD$278.95,Automóvil > SUPERMERCADOS NACIONAL
"Líder Nuggets De Pollo,  Paq (Peso Aprox. 0.8 Libras)",RD$174.95,Automóvil > SUPERMERCADOS NACIONAL
Yogurt Alto En Proteínas Pastoret 500 Gr,RD$424.95,Automóvil > SUPERMERCADOS NACIONAL
Servilletas Cuadradas Lider 250 Und/Paq,RD$97.95,Automóvil > SUPERMERCADOS NACIONAL
Filete De Calamar Importado Congelado Lb,RD$194.95,Automóvil > SUPERMERCADOS NACIONAL
"Queso Cheddar De Vermont Boar's Head, Lb",RD$379.95,Automóvil > SUPERMERCADOS NACIONAL
Marca - Boar’s Head,Precio no disponible,Automóvil > SUPERMERCADOS NACIONAL
Removedor De Manchas Para Ropa De Color Blancox 1000 Ml,RD$156.95,Automóvil > SUPERMERCADOS NACIONAL
Agua Carbonatada Sabor Sandia La Croix 12 Oz,RD$54.96,Automóvil > SUPERMERCADOS NACIONAL
Vinagre De Manzana Heinz 16 Onz,RD$228.95,Automóvil > SUPERMERCADOS NACIONAL
Jugo De Naranja Con Azucar 100% Rica 59 Onz,RD$194.95,Automóvil > SUPERMERCADOS NACIONAL
"Jamon De Cerdo Deluxe Boar's Head, Lb",RD$459.95,Automóvil > SUPERMERCADOS NACIONAL
Galleta Sandwich Choco Vainilla Dino 12 Und/Paq,RD$144.95,Automóvil > SUPERMERCADOS NACIONAL
Pan Baguette A La Leña La Panera,RD$74.96,Automóvil > SUPERMERCADOS NACIONAL
Mini Carne Para Hamburguesas Angus Rastelli´s 12 Und/Paq,RD$639.96,Automóvil > SUPERMERCADOS NACIONAL
Kéfir Natural Pastoret 500 Gr,RD$379.95,Automóvil > SUPERMERCADOS NACIONAL
Salchicha Desayuno El Criollo 396 Gr,RD$179.95,Automóvil > SUPERMERCADOS NACIONAL
Marca - El Criollo,Precio no disponible,Automóvil > SUPERMERCADOS NACIONAL
Marvel,RD$808.50,Automóvil > JUGUETÓN
Marvel X-Men Figura de Maggot con Accesorios,Precio no disponible,Automóvil > JUGUETÓN
Favoritos,Precio no disponible,Automóvil > JUGUETÓN
Marvel X-Men Figura de Sabretooth con Accesorios,Precio no disponible,Automóvil > JUGUETÓN
NERF,"RD$1,102.50",Automóvil > JUGUETÓN
Neft Lanzador Dinosquad Armorstrike,Precio no disponible,Automóvil > JUGUETÓN
Neft Fornite Lanzador Compact SMG,Precio no disponible,Automóvil > JUGUETÓN
Transformers,RD$763.50,Automóvil > JUGUETÓN
Transformer Legacy Deluxe Elita,Precio no disponible,Automóvil > JUGUETÓN
"Marvel Legends Figura The Sentry 6""",Precio no disponible,Automóvil > JUGUETÓN
Marvel Legends Figura Moon Knight Con Accesorios,Precio no disponible,Automóvil > JUGUETÓN
Marvel Legends Figura Ms Marvel Con Accesorios,Precio no disponible,Automóvil > JUGUETÓN
Spiderman,RD$808.50,Automóvil > JUGUETÓN
Spiderman Figura Hobgoblin,Precio no disponible,Automóvil > JUGUETÓN
Marvel Legends Figura Blue Marvel Con Accesorios,Precio no disponible,Automóvil > JUGUETÓN
The Avengers,RD$712.50,Automóvil > JUGUETÓN
Avengers Ironman Lanzador,Precio no disponible,Automóvil > JUGUETÓN
Avengers Figura Thanos,Precio no disponible,Automóvil > JUGUETÓN
Transformers Generations Legacy Leader Optimus Prime,Precio no disponible,Automóvil > JUGUETÓN
"Marverl Legends Gorr 6""",Precio no disponible,Automóvil > JUGUETÓN
Paw Patrol,RD$920.00,Automóvil > JUGUETÓN
"Piano, Batería y Disco con Luces",Precio no disponible,Automóvil > JUGUETÓN
Piano Electrónico,Precio no disponible,Automóvil > JUGUETÓN
Educational Insights,"RD$1,080.00",Automóvil > JUGUETÓN
Educational Insights Design and Drill Robot,Precio no disponible,Automóvil > JUGUETÓN
Hot Focus,RD$895.00,Automóvil > JUGUETÓN
Hot Focus Clipboard Mariposa,Precio no disponible,Automóvil > JUGUETÓN
Hot Focus Bolso Mariposa,Precio no disponible,Automóvil > JUGUETÓN
Hot Focus Set Maquillaje Mariposa,Precio no disponible,Automóvil > JUGUETÓN
Hot Focus Audifonos de Mariposa,Precio no disponible,Automóvil > JUGUETÓN
Hot Focus Termo de Mariposa,Precio no disponible,Automóvil > JUGUETÓN
Hot Focus Maletín de Cosméticos Arcoíris,Precio no disponible,Automóvil > JUGUETÓN
Hot Focus Set Uñas Arcoíris,Precio no disponible,Automóvil > JUGUETÓN
Hot Focus Estuche de de Mariposa,Precio no disponible,Automóvil > JUGUETÓN
Hot Focus Tatuajes Glow in the Dark,Precio no disponible,Automóvil > JUGUETÓN
Envíos y entregas,Precio no disponible,Automóvil > JUGUETÓN
Juguetón,Precio no disponible,Automóvil > JUGUETÓN
Información,Precio no disponible,Automóvil > JUGUETÓN
"Sobre
                    Nosotros",Precio no disponible,Automóvil > JUGUETÓN
Jugueton,Precio no disponible,Automóvil > JUGUETÓN
Pampers,"RD$2,099.95",Automóvil > BEBÉ MUNDO
Pañales Swaddlers S5 Super Pack Pampers 58 Und/Paq,Precio no disponible,Automóvil > BEBÉ MUNDO
Favoritos,Precio no disponible,Automóvil > BEBÉ MUNDO
Cerave,RD$684.96,Automóvil > BEBÉ MUNDO
Crema Corporal Hidratante Cerave Baby 5 Onz,Precio no disponible,Automóvil > BEBÉ MUNDO
Bigjig Toys,RD$975.01,Automóvil > BEBÉ MUNDO
Rompecabeza Escondite,Precio no disponible,Automóvil > BEBÉ MUNDO
Kalencom,RD$425.00,Automóvil > BEBÉ MUNDO
Repuesto Para Bacinilla,Precio no disponible,Automóvil > BEBÉ MUNDO
Bento Neat Jr Rosa,RD$995.00,Automóvil > BEBÉ MUNDO
Born,"RD$1,750.00",Automóvil > BEBÉ MUNDO
Inodoro 4 En 1 Blanco,Precio no disponible,Automóvil > BEBÉ MUNDO
Pañales Swaddlers S3 Super Pack Pampers 78 Und/Paq,Precio no disponible,Automóvil > BEBÉ MUNDO
Pañales Etapa 1 Pampers Swaddlers 96 Und/Paq,Precio no disponible,Automóvil > BEBÉ MUNDO
Pañales Etapa 2 Pampers Swaddlers 84 Und/Paq,Precio no disponible,Automóvil > BEBÉ MUNDO
Huggies,RD$240.95,Automóvil > BEBÉ MUNDO
Toallitas Húmedas Clean Soft Huggies 56 Und/Paq,Precio no disponible,Automóvil > BEBÉ MUNDO
Toallitas Húmedas Para Bebe Simply Clean Soft Huggies 64 Und/Paq,Precio no disponible,Automóvil > BEBÉ MUNDO
Crema Curativa Para Pañalitis Cerave Baby 3 Onz,Precio no disponible,Automóvil > BEBÉ MUNDO
Locion Corporal Hidratante Cerave Baby 8 Onz,Precio no disponible,Automóvil > BEBÉ MUNDO
Baberos Savanna de Silicona Azul,RD$475.00,Automóvil > BEBÉ MUNDO
Kikkaboo,RD$595.00,Automóvil > BEBÉ MUNDO
Bowl 4 en 1 Azul,Precio no disponible,Automóvil > BEBÉ MUNDO
Bowl Snack Rosado,Precio no disponible,Automóvil > BEBÉ MUNDO
Beaba,"RD$1,950.00",Automóvil > BEBÉ MUNDO
Set De Alimentación 4 Pzas,Precio no disponible,Automóvil > BEBÉ MUNDO
Set 2 Baberos Gris & Rosa,Precio no disponible,Automóvil > BEBÉ MUNDO
Vaso Sorbete Con Asas 10 Oz Azul,Precio no disponible,Automóvil > BEBÉ MUNDO
Carter's,"RD$1,195.00",Automóvil > BEBÉ MUNDO
Set Baberos Baby Pink,Precio no disponible,Automóvil > BEBÉ MUNDO
Flipping Holder,RD$675.00,Automóvil > BEBÉ MUNDO
Porta Jugo 2 En 1 Rosado,Precio no disponible,Automóvil > BEBÉ MUNDO
Saro,RD$595.00,Automóvil > BEBÉ MUNDO
Estuche De Cubiertos Rosa,Precio no disponible,Automóvil > BEBÉ MUNDO
Bumkins,"RD$1,375.00",Automóvil > BEBÉ MUNDO
Plato Con Cuchara  Gris,Precio no disponible,Automóvil > BEBÉ MUNDO
Alfombrilla Para Comer Finger Feeding,RD$750.00,Automóvil > BEBÉ MUNDO
Summer Infant,"RD$4,895.00",Automóvil > BEBÉ MUNDO
Booster Para Comer 4/1 Supersea  Rosa,Precio no disponible,Automóvil > BEBÉ MUNDO
Bent Go,RD$975.00,Automóvil > BEBÉ MUNDO
Biberón 9 oz Air Free Natural Response,RD$795.00,Automóvil > BEBÉ MUNDO
Crema Para Pañal Bebe Desitin 4 Onz,RD$884.95,Automóvil > BEBÉ MUNDO
Avent Set 5 Recipientes para Leche 6 oz,RD$695.00,Automóvil > BEBÉ MUNDO
Avent Esterilizador Eléctrico Advanced,"RD$6,995.00",Automóvil > BEBÉ MUNDO
Biberón 4 Oz Free Natural Respone,RD$636.00,Automóvil > BEBÉ MUNDO
Set 2 Biberones 9 oz Classic Avent Naturally,"RD$1,095.00",Automóvil > BEBÉ MUNDO
Avent Extractor Manual Comfort Vía,"RD$2,995.00",Automóvil > BEBÉ MUNDO
Multimóveis Cómoda Cuatro Gavetas,"RD$7,795.00",Automóvil > BEBÉ MUNDO
Coche Doona Royal Blue,"RD$53,495.00",Automóvil > BEBÉ MUNDO
Corral Commut Con Bouncer Starry Night,"RD$10,975.00",Automóvil > BEBÉ MUNDO
AUTOCRACIA S.A.,"RD$1,400.00",Automóvil > CUESTA LIBROS
CAMINO DE LIBERTAD,"RD$1,650.00",Automóvil > CUESTA LIBROS
CODIGO FUENTE. MIS INICIOS (TD),"RD$1,500.00",Automóvil > CUESTA LIBROS
LAS 12 COMPETENCIAS DE LA INTELIGENCIA,"RD$1,450.00",Automóvil > CUESTA LIBROS
LAS LEYES DE LA SUERTE,"RD$1,450.00",Automóvil > CUESTA LIBROS
ARDERA EL VIENTO (PA25),"RD$1,350.00",Automóvil > CUESTA LIBROS
EL REVERSO DE LA UTOPIA PERIODISTICA III,"RD$1,650.00",Automóvil > CUESTA LIBROS
HAY RIOS EN EL CIELO,"RD$1,500.00",Automóvil > CUESTA LIBROS
LOS NOMBRES DE FELIZA,"RD$1,350.00",Automóvil > CUESTA LIBROS
MI NOMBRE ES EMILIA DEL VALLE (TD) (ES),"RD$1,450.00",Automóvil > CUESTA LIBROS
DIOSES DEL JUEGO 1. THE STRIKER (ED.ESP.,"RD$1,700.00",Automóvil > CUESTA LIBROS
EN EL AMOR Y EN LA GUERRA (TD),"RD$1,500.00",Automóvil > CUESTA LIBROS
INVENCIBLE (SUN TZU),"RD$1,450.00",Automóvil > CUESTA LIBROS
JUEGO DE TRONOS (ED ILUSTR),"RD$2,200.00",Automóvil > CUESTA LIBROS
PECADOS 1. REY DE LA IRA (ED.ESP.),"RD$1,700.00",Automóvil > CUESTA LIBROS
PERCY JACKSON Y LA DIOSA DE TRES CABEZAS,"RD$1,150.00",Automóvil > CUESTA LIBROS
ALAS DE ONIX (EMPIREO 3) (EDIC. ESP.) MX,"RD$1,850.00",Automóvil > CUESTA LIBROS
AMANECER EN LA COSECHA (JUEGOS HAMBRE 5),"RD$1,450.00",Automóvil > CUESTA LIBROS
LA QUIMICA DEL AMOR (EDICION ESPECIAL),"RD$1,850.00",Automóvil > CUESTA LIBROS
LOS JUEGOS DEL HAMBRE 1. (EDIC. ESPECIAL,"RD$1,650.00",Automóvil > CUESTA LIBROS
Buscar,Precio no disponible,Automóvil > CUESTA LIBROS
JUMBO,Precio no disponible,Automóvil > CUESTA LIBROS
Sobre Nosotros,Precio no disponible,Automóvil > CUESTA LIBROS
JumboDo,Precio no disponible,Automóvil > CUESTA LIBROS
Bono CCN,Precio no disponible,Automóvil > BONOS CCN
Bono Madres,Precio no disponible,Automóvil > BONOS CCN
Bono Felicidades,Precio no disponible,Automóvil > BONOS CCN
Bono Gracias,Precio no disponible,Automóvil > BONOS CCN
Bono Regalo,Precio no disponible,Automóvil > BONOS CCN
Bono Nacional,Precio no disponible,Automóvil > BONOS CCN
Bono Jumbo,Precio no disponible,Automóvil > BONOS CCN
Bono Casa Cuesta,Precio no disponible,Automóvil > BONOS CCN
Bono Juguetón,Precio no disponible,Automóvil > BONOS CCN
Bono Bebemundo,Precio no disponible,Automóvil > BONOS CCN
Bono Cuesta Libros,Precio no disponible,Automóvil > BONOS CCN
Bono La Bodega,Precio no disponible,Automóvil > BONOS CCN
Iniciar Sesión,Precio no disponible,Automóvil > Mi Cuenta
Iniciar Sesión,Precio no disponible,Automóvil > Mis Listas
Iniciar Sesión,Precio no disponible,Automóvil > Mis Favoritos
Iniciar Sesión,Precio no disponible,Automóvil > Iniciar sesión
Buscar,Precio no disponible,Automóvil > Mi Carrito0
JUMBO,Precio no disponible,Automóvil > Mi Carrito0
Sobre Nosotros,Precio no disponible,Automóvil > Mi Carrito0
JumboDo,Precio no disponible,Automóvil > Mi Carrito0
Crema Antimanchas De Dia Nivea Cellular Luminous 40 Ml,"RD$1,219.96",Automóvil > Supermercado
Gel De Baño Oliva Y Aloe Palmolive 390 Ml,RD$278.95,Automóvil > Supermercado
Crema Ultra Humectante Jergens 18.5 Onz,RD$334.95,Automóvil > Supermercado
Tostitos Restaurant Style Familiar 283.5 Onz,RD$274.95,Automóvil > Supermercado
Esmalte Revlon Super Lustrous Red Affair,RD$389.95,Automóvil > Supermercado
Endurecedor De Uñas Con Ajo Y Limón Vogue,RD$118.96,Automóvil > Supermercado
Salchicha Para Hot Dog Emilio's 8 Und/Paq,RD$194.95,Automóvil > Supermercado
Cerveza Pequeña The One 12 Onz,RD$98.96,Automóvil > Supermercado
Licuadora Frigidaire 1.5LTS FBS30,"RD$4,395.00",Automóvil > Supermercado
Toalla Beige,RD$475.00,Automóvil > Supermercado
Limpiador Facial En Espuma Cerave 8 Oz,RD$994.99,Automóvil > Supermercado
Cerveza Presidente Regular Lata 8 Onz,RD$79.96,Automóvil > Supermercado
Set de Cocina 4 PZS Black & Decker CBBD1747,"RD$12,995.00",Automóvil > Supermercado
Nevera 10 Pc Whirlpool WRW27CKTWW,"RD$35,995.00",Automóvil > Supermercado
"Estufa Conex 30"" Negra AMG5G027","RD$22,895.00",Automóvil > Supermercado
Lavadora Semi-Automática 22KG Cetron  LTDR2224HBAB0,"RD$23,995.00",Automóvil > Supermercado
"Televisor Samsung Smart TV UHD 50"" UN50DU7000PXPA","RD$51,995.00",Automóvil > Supermercado
Jamón De Pavo Rebanado Checo 3/4 lB,RD$324.95,Automóvil > Supermercado
"Televisor Smart FHD Aiwa 43"" AW43B4SFG","RD$19,995.00",Automóvil > Supermercado
Uvas Verdes Timpson  Lb (Peso Aprox. 1 Libra),RD$229.95,Automóvil > Frutas y verduras Frescas
AGREGAR A LISTA,Precio no disponible,Automóvil > Frutas y verduras Frescas
Vasos De Papel Lider 8 Onz.,RD$139.95,Automóvil > Frutas y verduras Frescas
Higos Secos Líder 12 Onz,RD$129.95,Automóvil > Frutas y verduras Frescas
Dátiles Sin Semillas Líder 12 Onz,RD$139.95,Automóvil > Frutas y verduras Frescas
"Peras Asiaticas, Lb",RD$449.00,Automóvil > Frutas y verduras Frescas
"Manzana Pink Landy, Lb",RD$88.95,Automóvil > Frutas y verduras Frescas
Cranberries Líder 10 Oz,RD$139.95,Automóvil > Frutas y verduras Frescas
"Sandía Roja Sin Semilla, Lb",RD$29.95,Automóvil > Frutas y verduras Frescas
Melón Amarillo Honeydew Und,RD$78.95,Automóvil > Frutas y verduras Frescas
"Peras De Anjou Rojas, Lb (Aprox. 2 Peras Por Libra)",RD$139.95,Automóvil > Frutas y verduras Frescas
Mango Madame Francoise,RD$29.95,Automóvil > Frutas y verduras Frescas
"POMELO IMPORTADO, LB (aprox. 1 a 2 pomelos por libra)",RD$138.95,Automóvil > Frutas y verduras Frescas
China Barceló 5 Lb,RD$248.95,Automóvil > Frutas y verduras Frescas
Aguacate Popenoe 1 Und,RD$75.00,Automóvil > Frutas y verduras Frescas
Limón Amarillo Lb,RD$135.00,Automóvil > Frutas y verduras Frescas
Manzana Verde Granny Smith 3 Lb,RD$264.00,Automóvil > Frutas y verduras Frescas
Manzana Gala Orgánica 3 Lb,RD$279.00,Automóvil > Frutas y verduras Frescas
Aguacate Criollo,RD$75.00,Automóvil > Frutas y verduras Frescas
Mango Grano De Oro,RD$29.00,Automóvil > Frutas y verduras Frescas
Fresas Selectas Criollas 1 Lb,RD$224.00,Automóvil > Frutas y verduras Frescas
Pulpa De Tamarindo 1 Lb,RD$54.95,Automóvil > Frutas y verduras Frescas
"Coco Seco, Und",RD$68.95,Automóvil > Frutas y verduras Frescas
Limón Persa Líder Fresh Malla 2 Lb,RD$130.00,Automóvil > Frutas y verduras Frescas
Naranja Líder Fresh Malla 5 Lb,RD$269.95,Automóvil > Frutas y verduras Frescas
"Peras Bosc, Lb (Aprox. 2 Peras Por Libra)",RD$199.00,Automóvil > Frutas y verduras Frescas
Manzana Gala/Cameo Lb (Aprox. 3 A 4 Manzanas Por Libra),RD$88.95,Automóvil > Frutas y verduras Frescas
"Manzana Fuji/Jonagold, Lb (Aprox. 2 A 3 Manzanas Por Libra)",RD$88.95,Automóvil > Frutas y verduras Frescas
"Kiwi Fresco Importado, Lb (Aprox. 6 A 8 Kiwis Por Libra)",RD$275.00,Automóvil > Frutas y verduras Frescas
"Ciruela Negra, Lb (Aprox. 3 A 4 Ciruelas Por Libra)",RD$139.00,Automóvil > Frutas y verduras Frescas
"Uvas Rojas Globe California, Lb",RD$168.95,Automóvil > Frutas y verduras Frescas
Uvas Verdes Timpson  Lb (Peso Aprox. 1 Libra),RD$229.95,Automóvil > Frutas Frescas
AGREGAR A LISTA,Precio no disponible,Automóvil > Frutas Frescas
Vasos De Papel Lider 8 Onz.,RD$139.95,Automóvil > Frutas Frescas
Higos Secos Líder 12 Onz,RD$129.95,Automóvil > Frutas Frescas
Dátiles Sin Semillas Líder 12 Onz,RD$139.95,Automóvil > Frutas Frescas
"Peras Asiaticas, Lb",RD$449.00,Automóvil > Frutas Frescas
"Manzana Pink Landy, Lb",RD$88.95,Automóvil > Frutas Frescas
Cranberries Líder 10 Oz,RD$139.95,Automóvil > Frutas Frescas
"Sandía Roja Sin Semilla, Lb",RD$29.95,Automóvil > Frutas Frescas
Melón Amarillo Honeydew Und,RD$78.95,Automóvil > Frutas Frescas
"Peras De Anjou Rojas, Lb (Aprox. 2 Peras Por Libra)",RD$139.95,Automóvil > Frutas Frescas
Mango Madame Francoise,RD$29.95,Automóvil > Frutas Frescas
"POMELO IMPORTADO, LB (aprox. 1 a 2 pomelos por libra)",RD$138.95,Automóvil > Frutas Frescas
China Barceló 5 Lb,RD$248.95,Automóvil > Frutas Frescas
Aguacate Popenoe 1 Und,RD$75.00,Automóvil > Frutas Frescas
Limón Amarillo Lb,RD$135.00,Automóvil > Frutas Frescas
