nombre,precio,categoria
Crema Antimanchas De Dia Nivea Cellular Luminous 40 Ml,"RD$1,219.96",Supermercado
Gel De Baño Oliva Y Aloe Palmolive 390 Ml,RD$278.95,Supermercado
Crema Ultra Humectante Jergens 18.5 Onz,RD$334.95,Supermercado
Tostitos Restaurant Style Familiar 283.5 Onz,RD$274.95,Supermercado
Esmalte Revlon Super Lustrous Red Affair,RD$389.95,Supermercado
Endurecedor De Uñas Con Ajo Y Limón Vogue,RD$118.96,Supermercado
Salchicha Para Hot Dog Emilio's 8 Und/Paq,RD$194.95,Supermercado
Cerveza Pequeña The One 12 Onz,RD$98.96,Supermercado
Licuadora Frigidaire 1.5LTS FBS30,"RD$4,395.00",Supermercado
Toalla Beige,RD$475.00,Supermercado
Limpiador Facial En Espuma Cerave 8 Oz,RD$994.99,Supermercado
Cerveza Presidente Regular Lata 8 Onz,RD$79.96,Supermercado
Set de Cocina 4 PZS Black & Decker CBBD1747,"RD$12,995.00",Supermercado
Nevera 10 Pc Whirlpool WRW27CKTWW,"RD$35,995.00",Supermercado
"Estufa Conex 30"" Negra AMG5G027","RD$22,895.00",Supermercado
Lavadora Semi-Automática 22KG Cetron  LTDR2224HBAB0,"RD$23,995.00",Supermercado
"Televisor Samsung Smart TV UHD 50"" UN50DU7000PXPA","RD$51,995.00",Supermercado
Jamón De Pavo Rebanado Checo 3/4 lB,RD$324.95,Supermercado
"Televisor Smart FHD Aiwa 43"" AW43B4SFG","RD$19,995.00",Supermercado
Crema Antimanchas De Dia Nivea Cellular Luminous 40 Ml,"RD$1,219.96",Supermercado > Supermercado
Gel De Baño Oliva Y Aloe Palmolive 390 Ml,RD$278.95,Supermercado > Supermercado
Crema Ultra Humectante Jergens 18.5 Onz,RD$334.95,Supermercado > Supermercado
Tostitos Restaurant Style Familiar 283.5 Onz,RD$274.95,Supermercado > Supermercado
Esmalte Revlon Super Lustrous Red Affair,RD$389.95,Supermercado > Supermercado
Endurecedor De Uñas Con Ajo Y Limón Vogue,RD$118.96,Supermercado > Supermercado
Salchicha Para Hot Dog Emilio's 8 Und/Paq,RD$194.95,Supermercado > Supermercado
Cerveza Pequeña The One 12 Onz,RD$98.96,Supermercado > Supermercado
Licuadora Frigidaire 1.5LTS FBS30,"RD$4,395.00",Supermercado > Supermercado
Toalla Beige,RD$475.00,Supermercado > Supermercado
Limpiador Facial En Espuma Cerave 8 Oz,RD$994.99,Supermercado > Supermercado
Cerveza Presidente Regular Lata 8 Onz,RD$79.96,Supermercado > Supermercado
Set de Cocina 4 PZS Black & Decker CBBD1747,"RD$12,995.00",Supermercado > Supermercado
Nevera 10 Pc Whirlpool WRW27CKTWW,"RD$35,995.00",Supermercado > Supermercado
"Estufa Conex 30"" Negra AMG5G027","RD$22,895.00",Supermercado > Supermercado
Lavadora Semi-Automática 22KG Cetron  LTDR2224HBAB0,"RD$23,995.00",Supermercado > Supermercado
"Televisor Samsung Smart TV UHD 50"" UN50DU7000PXPA","RD$51,995.00",Supermercado > Supermercado
Jamón De Pavo Rebanado Checo 3/4 lB,RD$324.95,Supermercado > Supermercado
"Televisor Smart FHD Aiwa 43"" AW43B4SFG","RD$19,995.00",Supermercado > Supermercado
Uvas Verdes Timpson  Lb (Peso Aprox. 1 Libra),RD$229.95,Supermercado > Frutas y verduras Frescas
AGREGAR A LISTA,Precio no disponible,Supermercado > Frutas y verduras Frescas
Vasos De Papel Lider 8 Onz.,RD$139.95,Supermercado > Frutas y verduras Frescas
Higos Secos Líder 12 Onz,RD$129.95,Supermercado > Frutas y verduras Frescas
Dátiles Sin Semillas Líder 12 Onz,RD$139.95,Supermercado > Frutas y verduras Frescas
"Peras Asiaticas, Lb",RD$449.00,Supermercado > Frutas y verduras Frescas
"Manzana Pink Landy, Lb",RD$88.95,Supermercado > Frutas y verduras Frescas
Cranberries Líder 10 Oz,RD$139.95,Supermercado > Frutas y verduras Frescas
"Sandía Roja Sin Semilla, Lb",RD$29.95,Supermercado > Frutas y verduras Frescas
Melón Amarillo Honeydew Und,RD$78.95,Supermercado > Frutas y verduras Frescas
"Peras De Anjou Rojas, Lb (Aprox. 2 Peras Por Libra)",RD$139.95,Supermercado > Frutas y verduras Frescas
Mango Madame Francoise,RD$29.95,Supermercado > Frutas y verduras Frescas
"POMELO IMPORTADO, LB (aprox. 1 a 2 pomelos por libra)",RD$138.95,Supermercado > Frutas y verduras Frescas
China Barceló 5 Lb,RD$248.95,Supermercado > Frutas y verduras Frescas
Aguacate Popenoe 1 Und,RD$75.00,Supermercado > Frutas y verduras Frescas
Limón Amarillo Lb,RD$135.00,Supermercado > Frutas y verduras Frescas
Manzana Verde Granny Smith 3 Lb,RD$264.00,Supermercado > Frutas y verduras Frescas
Manzana Gala Orgánica 3 Lb,RD$279.00,Supermercado > Frutas y verduras Frescas
Aguacate Criollo,RD$75.00,Supermercado > Frutas y verduras Frescas
Mango Grano De Oro,RD$29.00,Supermercado > Frutas y verduras Frescas
Fresas Selectas Criollas 1 Lb,RD$224.00,Supermercado > Frutas y verduras Frescas
Pulpa De Tamarindo 1 Lb,RD$54.95,Supermercado > Frutas y verduras Frescas
"Coco Seco, Und",RD$68.95,Supermercado > Frutas y verduras Frescas
Limón Persa Líder Fresh Malla 2 Lb,RD$130.00,Supermercado > Frutas y verduras Frescas
Naranja Líder Fresh Malla 5 Lb,RD$269.95,Supermercado > Frutas y verduras Frescas
"Peras Bosc, Lb (Aprox. 2 Peras Por Libra)",RD$199.00,Supermercado > Frutas y verduras Frescas
Manzana Gala/Cameo Lb (Aprox. 3 A 4 Manzanas Por Libra),RD$88.95,Supermercado > Frutas y verduras Frescas
"Manzana Fuji/Jonagold, Lb (Aprox. 2 A 3 Manzanas Por Libra)",RD$88.95,Supermercado > Frutas y verduras Frescas
"Kiwi Fresco Importado, Lb (Aprox. 6 A 8 Kiwis Por Libra)",RD$275.00,Supermercado > Frutas y verduras Frescas
"Ciruela Negra, Lb (Aprox. 3 A 4 Ciruelas Por Libra)",RD$139.00,Supermercado > Frutas y verduras Frescas
"Uvas Rojas Globe California, Lb",RD$168.95,Supermercado > Frutas y verduras Frescas
Uvas Verdes Timpson  Lb (Peso Aprox. 1 Libra),RD$229.95,Supermercado > Frutas Frescas
AGREGAR A LISTA,Precio no disponible,Supermercado > Frutas Frescas
Vasos De Papel Lider 8 Onz.,RD$139.95,Supermercado > Frutas Frescas
Higos Secos Líder 12 Onz,RD$129.95,Supermercado > Frutas Frescas
Dátiles Sin Semillas Líder 12 Onz,RD$139.95,Supermercado > Frutas Frescas
"Peras Asiaticas, Lb",RD$449.00,Supermercado > Frutas Frescas
"Manzana Pink Landy, Lb",RD$88.95,Supermercado > Frutas Frescas
Cranberries Líder 10 Oz,RD$139.95,Supermercado > Frutas Frescas
"Sandía Roja Sin Semilla, Lb",RD$29.95,Supermercado > Frutas Frescas
Melón Amarillo Honeydew Und,RD$78.95,Supermercado > Frutas Frescas
"Peras De Anjou Rojas, Lb (Aprox. 2 Peras Por Libra)",RD$139.95,Supermercado > Frutas Frescas
Mango Madame Francoise,RD$29.95,Supermercado > Frutas Frescas
"POMELO IMPORTADO, LB (aprox. 1 a 2 pomelos por libra)",RD$138.95,Supermercado > Frutas Frescas
China Barceló 5 Lb,RD$248.95,Supermercado > Frutas Frescas
Aguacate Popenoe 1 Und,RD$75.00,Supermercado > Frutas Frescas
Limón Amarillo Lb,RD$135.00,Supermercado > Frutas Frescas
Manzana Verde Granny Smith 3 Lb,RD$264.00,Supermercado > Frutas Frescas
Manzana Gala Orgánica 3 Lb,RD$279.00,Supermercado > Frutas Frescas
Aguacate Criollo,RD$75.00,Supermercado > Frutas Frescas
Mango Grano De Oro,RD$29.00,Supermercado > Frutas Frescas
Fresas Selectas Criollas 1 Lb,RD$224.00,Supermercado > Frutas Frescas
Pulpa De Tamarindo 1 Lb,RD$54.95,Supermercado > Frutas Frescas
"Coco Seco, Und",RD$68.95,Supermercado > Frutas Frescas
Limón Persa Líder Fresh Malla 2 Lb,RD$130.00,Supermercado > Frutas Frescas
Naranja Líder Fresh Malla 5 Lb,RD$269.95,Supermercado > Frutas Frescas
"Peras Bosc, Lb (Aprox. 2 Peras Por Libra)",RD$199.00,Supermercado > Frutas Frescas
Manzana Gala/Cameo Lb (Aprox. 3 A 4 Manzanas Por Libra),RD$88.95,Supermercado > Frutas Frescas
"Manzana Fuji/Jonagold, Lb (Aprox. 2 A 3 Manzanas Por Libra)",RD$88.95,Supermercado > Frutas Frescas
"Kiwi Fresco Importado, Lb (Aprox. 6 A 8 Kiwis Por Libra)",RD$275.00,Supermercado > Frutas Frescas
"Ciruela Negra, Lb (Aprox. 3 A 4 Ciruelas Por Libra)",RD$139.00,Supermercado > Frutas Frescas
"Uvas Rojas Globe California, Lb",RD$168.95,Supermercado > Frutas Frescas
"Alcachofa, Lb (Aprox. 2 unidades Por Libra)",RD$339.95,Supermercado > Hortalizas
AGREGAR A LISTA,Precio no disponible,Supermercado > Hortalizas
"Calabacin Mantequilla Importado,Lb (Peso Aprox. 3.2 Libras)",RD$79.95,Supermercado > Hortalizas
"Repollo Morado Importado, Und",RD$299.95,Supermercado > Hortalizas
"Repollo Verde Importado, Und",RD$119.95,Supermercado > Hortalizas
Tomate Uva Bandeja (Peso Aprox. 2 Libras Por Bandeja),RD$164.95,Supermercado > Hortalizas
Perejil Rizado 82 Gr,RD$44.00,Supermercado > Hortalizas
Perejil Liso 82 Gr,RD$44.00,Supermercado > Hortalizas
Lechuga Romana Roja Hidropónica,RD$109.95,Supermercado > Hortalizas
Lechuga Batavia Hidropónica,RD$44.95,Supermercado > Hortalizas
Arrúgula Hidropónica,RD$54.95,Supermercado > Hortalizas
Escarola Hidropónica 3 Onz,RD$59.95,Supermercado > Hortalizas
Puerro Hidropónico 3 Onz,RD$48.00,Supermercado > Hortalizas
Cilantro Hidropónico,RD$48.00,Supermercado > Hortalizas
Ajo Elefante Paquete,RD$199.00,Supermercado > Hortalizas
Tomate Cherry Amarillo 12 Onz,RD$49.00,Supermercado > Hortalizas
"Penca De Sábila, Lb",RD$32.95,Supermercado > Hortalizas
Ají Habanero 12 Onz,RD$78.95,Supermercado > Hortalizas
Rábano 16 Onz,RD$189.95,Supermercado > Hortalizas
Tomate Uva Líder 16 Onz,RD$64.95,Supermercado > Hortalizas
"Tomate De Ensalada Premium, Lb",RD$56.95,Supermercado > Hortalizas
Albahaca Verde Trudeau 40 Gr,RD$58.95,Supermercado > Hortalizas
Zucchini Calabacin Paq,RD$44.95,Supermercado > Hortalizas
Romero Trudeau 40 Gr,RD$58.95,Supermercado > Hortalizas
"Guandules Verdes Frescos, Lb",RD$149.00,Supermercado > Hortalizas
Cilantro Ancho Inahnsa,RD$48.00,Supermercado > Hortalizas
Espinaca Bok Choy Trudeau,RD$69.95,Supermercado > Hortalizas
Hongo Champiñón Crimini 1/2 Lb,RD$318.95,Supermercado > Hortalizas
"Tomate Hidropónico, Lb",RD$49.95,Supermercado > Hortalizas
"Vainitas Largas, Lb",RD$43.95,Supermercado > Hortalizas
"Vainita Española Líder Fresh, Lb",RD$39.95,Supermercado > Hortalizas
Papa Petit Mixta Paq.(Aprox. 10-12 Unidades Por 1.5 Libras),RD$439.00,Supermercado > Viveres
AGREGAR A LISTA,Precio no disponible,Supermercado > Viveres
"Papa Petit Amarilla, Malla 1.5 Lb",RD$399.00,Supermercado > Viveres
"Papa Petit Roja, 1.5 Lb",RD$399.00,Supermercado > Viveres
Batata Roja Lb,RD$33.00,Supermercado > Viveres
Plátano Maduro,RD$19.00,Supermercado > Viveres
Plátano Verde,RD$19.00,Supermercado > Viveres
"Yautía Coco, Lb (Aprox. 1 Yautía Por Libra)",RD$64.00,Supermercado > Viveres
"Yautí Blanca/ Morada, Lb (Aprox. 2 A 3 Yautías Por Libra)",RD$64.00,Supermercado > Viveres
"Yautía Amarilla, Lb (Aprox. 1 A 2 Yautías Por Libra)",RD$64.00,Supermercado > Viveres
Papa Roja Premium 5 Lb,RD$325.00,Supermercado > Viveres
Papa Criolla Malla 5 Lb,RD$194.00,Supermercado > Viveres
"Guineo Verde, Mínimo De Compra 3 Lb (Aprox. 7 A 9 Guineos)",RD$17.95,Supermercado > Viveres
"Batata Amarilla, Lb",RD$33.00,Supermercado > Viveres
"Cúrcuma, Paquete 1 Lb",RD$98.95,Supermercado > Viveres
"Jengibre, Lb (Aprox. 10 A 12 Unidades Por Libra)",RD$108.95,Supermercado > Viveres
"Yuca Selecta Parafinada, Lb Mínimo De Compra 3 Lb (Aprox. 2 A 3 Yucas)",RD$23.00,Supermercado > Viveres
"Papas Selectas, Malla 5 Lb",RD$229.95,Supermercado > Viveres
"Rulo Verde, Und",RD$10.95,Supermercado > Viveres
"Mapuey, Lb",RD$98.95,Supermercado > Viveres
"Batata Anaranjada, Lb (Aprox. 1 A 2 Batatas Por Libra)",RD$54.95,Supermercado > Viveres
"Pollo Entero Fresco, Lb",RD$79.00,"Supermercado > Carnes, Pescados y Mariscos"
AGREGAR A LISTA,Precio no disponible,"Supermercado > Carnes, Pescados y Mariscos"
"Pollo Entero Congelado, Lb",RD$74.95,"Supermercado > Carnes, Pescados y Mariscos"
Pierna De Cerdo Lb,RD$124.95,"Supermercado > Carnes, Pescados y Mariscos"
"Paleta De Cerdo, Lb",RD$119.95,"Supermercado > Carnes, Pescados y Mariscos"
Pierna de Cerdo,RD$124.95,"Supermercado > Carnes, Pescados y Mariscos"
Pavo Congelado Butterball 16-18 Lbs,RD$184.95,"Supermercado > Carnes, Pescados y Mariscos"
"Pierna de Cerdo Asada Congelada, Lb",RD$269.95,"Supermercado > Carnes, Pescados y Mariscos"
Pavo Congelado 10-16 Lbs,RD$109.95,"Supermercado > Carnes, Pescados y Mariscos"
"Muslo de Pavo, Lb",RD$116.95,"Supermercado > Carnes, Pescados y Mariscos"
Pechuga De Pavo Entera 4-8 Lbs,RD$284.95,"Supermercado > Carnes, Pescados y Mariscos"
"Pavo Ahumado Butterball, Lb",RD$259.95,"Supermercado > Carnes, Pescados y Mariscos"
"Pollo Entero Congelado Yaque, Lb",RD$74.95,"Supermercado > Carnes, Pescados y Mariscos"
Carne Molida Black Angus Rastelli’s Paq. (Peso Aprox. 1 Libra),RD$429.95,"Supermercado > Carnes, Pescados y Mariscos"
Carne Molida Wagyu Rastelli’s Paq. (Peso Aprox. 1 Libra),RD$549.95,"Supermercado > Carnes, Pescados y Mariscos"
Carne Para Hamburguesas Angus Rastelli´s 6 Und/Paq,RD$979.96,"Supermercado > Carnes, Pescados y Mariscos"
"Alas de Pollo Congeladas Yaque, Lb",RD$128.95,"Supermercado > Carnes, Pescados y Mariscos"
Escalopines de Pollo al pesto Lb,RD$264.95,"Supermercado > Carnes, Pescados y Mariscos"
Hamburguesa de Ternera Lb,RD$289.95,"Supermercado > Carnes, Pescados y Mariscos"
"Churrasco De Cerdo, Lb",RD$279.95,"Supermercado > Carnes, Pescados y Mariscos"
"Alas De Pollo Organicas Congeladas Bell & Evans, Lb",RD$479.95,"Supermercado > Carnes, Pescados y Mariscos"
"Nuggets De Pavo, Lb",RD$349.95,"Supermercado > Carnes, Pescados y Mariscos"
Hamburguesas Pavo Butterball 32 Oz,RD$969.96,"Supermercado > Carnes, Pescados y Mariscos"
"Muslo Largo De Pollo Orgánico Congelado Bell & Evans, Lb",RD$379.95,"Supermercado > Carnes, Pescados y Mariscos"
Pulled Beef Angus Brisket Cuatro Patas 12 Onz,RD$589.95,"Supermercado > Carnes, Pescados y Mariscos"
Gallinita Kiki 20 Onz,RD$379.95,"Supermercado > Carnes, Pescados y Mariscos"
Pulled Pork Cuatropatas 16 Onz.,RD$399.95,"Supermercado > Carnes, Pescados y Mariscos"
"Mix Caldo De Pollo Free Farm, Lb",RD$99.95,"Supermercado > Carnes, Pescados y Mariscos"
"Philly Steak Certified Angus Beef, Lb",RD$399.95,"Supermercado > Carnes, Pescados y Mariscos"
Pollo Entero Free Farm Lb,RD$189.95,"Supermercado > Carnes, Pescados y Mariscos"
Hamburguesa De Res Super Yoyo's 4 Und/Paq,RD$749.96,"Supermercado > Carnes, Pescados y Mariscos"
"Pollo Entero Fresco, Lb",RD$79.00,Supermercado > Carnes
AGREGAR A LISTA,Precio no disponible,Supermercado > Carnes
"Pollo Entero Congelado, Lb",RD$74.95,Supermercado > Carnes
Pierna De Cerdo Lb,RD$124.95,Supermercado > Carnes
"Paleta De Cerdo, Lb",RD$119.95,Supermercado > Carnes
Pierna de Cerdo,RD$124.95,Supermercado > Carnes
Pavo Congelado Butterball 16-18 Lbs,RD$184.95,Supermercado > Carnes
"Pierna de Cerdo Asada Congelada, Lb",RD$269.95,Supermercado > Carnes
Pavo Congelado 10-16 Lbs,RD$109.95,Supermercado > Carnes
"Muslo de Pavo, Lb",RD$116.95,Supermercado > Carnes
Pechuga De Pavo Entera 4-8 Lbs,RD$284.95,Supermercado > Carnes
"Pavo Ahumado Butterball, Lb",RD$259.95,Supermercado > Carnes
"Pollo Entero Congelado Yaque, Lb",RD$74.95,Supermercado > Carnes
Carne Molida Black Angus Rastelli’s Paq. (Peso Aprox. 1 Libra),RD$429.95,Supermercado > Carnes
Carne Molida Wagyu Rastelli’s Paq. (Peso Aprox. 1 Libra),RD$549.95,Supermercado > Carnes
Carne Para Hamburguesas Angus Rastelli´s 6 Und/Paq,RD$979.96,Supermercado > Carnes
"Alas de Pollo Congeladas Yaque, Lb",RD$128.95,Supermercado > Carnes
Escalopines de Pollo al pesto Lb,RD$264.95,Supermercado > Carnes
Hamburguesa de Ternera Lb,RD$289.95,Supermercado > Carnes
"Churrasco De Cerdo, Lb",RD$279.95,Supermercado > Carnes
"Alas De Pollo Organicas Congeladas Bell & Evans, Lb",RD$479.95,Supermercado > Carnes
"Nuggets De Pavo, Lb",RD$349.95,Supermercado > Carnes
Hamburguesas Pavo Butterball 32 Oz,RD$969.96,Supermercado > Carnes
"Muslo Largo De Pollo Orgánico Congelado Bell & Evans, Lb",RD$379.95,Supermercado > Carnes
Pulled Beef Angus Brisket Cuatro Patas 12 Onz,RD$589.95,Supermercado > Carnes
Gallinita Kiki 20 Onz,RD$379.95,Supermercado > Carnes
Pulled Pork Cuatropatas 16 Onz.,RD$399.95,Supermercado > Carnes
"Mix Caldo De Pollo Free Farm, Lb",RD$99.95,Supermercado > Carnes
"Philly Steak Certified Angus Beef, Lb",RD$399.95,Supermercado > Carnes
Pollo Entero Free Farm Lb,RD$189.95,Supermercado > Carnes
Hamburguesa De Res Super Yoyo's 4 Und/Paq,RD$749.96,Supermercado > Carnes
"Bacalao Noruego, Lb",RD$159.95,Supermercado > Pescados y Mariscos
AGREGAR A LISTA,Precio no disponible,Supermercado > Pescados y Mariscos
Lisa Importada,RD$84.96,Supermercado > Pescados y Mariscos
"Rodajas De Carite, Paq, (Peso Aprox. 1 Libra)",RD$359.95,Supermercado > Pescados y Mariscos
"Anillas De Calamar, Paq. (Peso Aprox. 1 Libra)",RD$229.95,Supermercado > Pescados y Mariscos
Lomo De Bacalao Desalado Riberalves 550 Gr.,"RD$1,109.95",Supermercado > Pescados y Mariscos
Bacalao con Nata Riberalves 300 Gr.,RD$259.95,Supermercado > Pescados y Mariscos
Lomos De Bacalao Finos Saithe Riberalves 600 Gr.,RD$499.95,Supermercado > Pescados y Mariscos
Calamar de California 1 Lb,RD$399.95,Supermercado > Pescados y Mariscos
Salmón Ahumado Royal 80 Gr.,RD$509.95,Supermercado > Pescados y Mariscos
Filete de Lubina (Aprox. 3-5 Onz),RD$789.95,Supermercado > Pescados y Mariscos
Camarón Crudo 26/30 Congelado Cape Covelle 1 Lb,RD$499.95,Supermercado > Pescados y Mariscos
Filete De Salmon Keta Congelado Full Circle 12 Onz,RD$899.95,Supermercado > Pescados y Mariscos
Filete De Halibut Congelado Full Circle 12 Onz,"RD$2,199.95",Supermercado > Pescados y Mariscos
Dados De Salmon Ahumado Congelado Royal 120 Gr,RD$789.95,Supermercado > Pescados y Mariscos
Salmon Ahumado Congelado Royal 180 Gr,"RD$1,229.95",Supermercado > Pescados y Mariscos
Boquerones y Anchoas en Aceite de Oliva Manuel Claros,RD$349.95,Supermercado > Pescados y Mariscos
Trucha Ahumada Congelada Royal 80 Grs,RD$629.95,Supermercado > Pescados y Mariscos
Salmón Ahumado Con Pimienta Congelado Gourmar 6 Onz,RD$849.95,Supermercado > Pescados y Mariscos
Salmón Ahumado Gourmar 227 Gr,"RD$1,159.95",Supermercado > Pescados y Mariscos
Filete De Bacalao Alaskan Congelado Full Circle 12 Onz,RD$979.95,Supermercado > Pescados y Mariscos
Salmón Ahumado Gourmar 85 Gr,RD$499.95,Supermercado > Pescados y Mariscos
Salmón Ahumado Sokker 100 Gr,RD$499.95,Supermercado > Pescados y Mariscos
Surimi En Masa Vima 500 Gr,RD$229.95,Supermercado > Pescados y Mariscos
Muslitos De Mar Vima 250 Gr,RD$259.95,Supermercado > Pescados y Mariscos
Tentáculo De Pulpo Precocido Congelado 300 Gr,"RD$1,199.95",Supermercado > Pescados y Mariscos
"Bacalao Gadus, Lb",RD$379.95,Supermercado > Pescados y Mariscos
Filetes De Bacalao Congelado Royal 400 Grs,RD$769.95,Supermercado > Pescados y Mariscos
Lomo De Bacalao Congelado Royal 300 Gr,RD$649.95,Supermercado > Pescados y Mariscos
Angulas Del Nordeste Congeladas 200 Gr,RD$499.95,Supermercado > Pescados y Mariscos
Boquerones Lb,RD$209.95,Supermercado > Pescados y Mariscos
Yogurt Griego Origen Sin Azúcar 28 Onz.,RD$349.95,Supermercado > Lacteos y Huevos
AGREGAR A LISTA,Precio no disponible,Supermercado > Lacteos y Huevos
Yogurt Griego Origen Sin Azúcar  5.3 Onz.,RD$89.95,Supermercado > Lacteos y Huevos
Yogurt Griego De Vainilla Origen 5.3Onz.,RD$89.95,Supermercado > Lacteos y Huevos
Yogurt Griego De Fresa Origen 5.3Onz.,RD$89.95,Supermercado > Lacteos y Huevos
Yogurt Griego Con Melocotón Yoka 150 Gr.,RD$89.95,Supermercado > Lacteos y Huevos
Yogurt Bebible Sabor Ponche Lider 32 Onz.,RD$109.95,Supermercado > Lacteos y Huevos
Crema  Para Montar Asturiana 1 Lt,RD$399.95,Supermercado > Lacteos y Huevos
Leche Evaporada Carnation 6Pack 312g,RD$344.95,Supermercado > Lacteos y Huevos
Mantequilla De Almendra Sin Gluten Eva 200 Gr,RD$524.95,Supermercado > Lacteos y Huevos
Yogurt Griego Plain Oikos 32 Onz,RD$699.95,Supermercado > Lacteos y Huevos
Yogurt Griego Sabor Vainilla Light+Fit 5.3 Onz,RD$199.95,Supermercado > Lacteos y Huevos
Yogurt Griego Sabor Fresa Oikos Pro 5.3 Onz.,RD$214.95,Supermercado > Lacteos y Huevos
Yogurt Griego Vainilla Oikos Pro 5.3 Onz.,RD$214.95,Supermercado > Lacteos y Huevos
Yogurt Sabor Melocotón Light+Fit 5.3 Onz,RD$109.95,Supermercado > Lacteos y Huevos
Yogurt Sabor Blueberry Light+Fit 5.3 Onz,RD$109.95,Supermercado > Lacteos y Huevos
Crema Agria Light Daisy 16 Onz,RD$399.95,Supermercado > Lacteos y Huevos
Crema Agria Daisy 14 Onz,RD$299.95,Supermercado > Lacteos y Huevos
Leche En Polvo  Sin Azúcar Milex Kinder Bueno 2000 Gr.,"RD$1,774.95",Supermercado > Lacteos y Huevos
Fórmula en Polvo Avanzada Alacta Kids  1500 Gr,"RD$1,883.95",Supermercado > Lacteos y Huevos
Fórmula en Polvo Avanzada Alacta Kids 800 Gr,"RD$1,116.95",Supermercado > Lacteos y Huevos
Fórmula en Polvo Alacta Advance 1500 Gr,"RD$2,353.95",Supermercado > Lacteos y Huevos
Fórmula en Polvo Alacta Advance 800 Gr,"RD$1,393.95",Supermercado > Lacteos y Huevos
Leche En Polvo Sin Azúcar Milex Kinder Bueno 800 Gr.,RD$778.95,Supermercado > Lacteos y Huevos
Margarina en Barra Blue Bonnet 16 Onz,RD$189.95,Supermercado > Lacteos y Huevos
Leche de Soya Nutra Junior 400 Gr,RD$468.95,Supermercado > Lacteos y Huevos
Leche Sabor Vainilla Parmalat 330 Ml,RD$48.95,Supermercado > Lacteos y Huevos
Yogurt Sabor Vainilla Con M&Ms Yo-Crunch 4 Und/Paq 4 Onz,RD$339.95,Supermercado > Lacteos y Huevos
Yogurt Griego Con Coco Yoka 150 Gr.,RD$89.95,Supermercado > Lacteos y Huevos
Yogurt Griego Con Fresa Yoka 150 Gr.,RD$89.95,Supermercado > Lacteos y Huevos
Yogurt De Vainilla Con Oreo Yo-Crunch 4 Und/Paq 4 Onz,RD$339.95,Supermercado > Lacteos y Huevos
Yogurt Griego Origen Sin Azúcar 28 Onz.,RD$349.95,Supermercado > Lácteos
AGREGAR A LISTA,Precio no disponible,Supermercado > Lácteos
Yogurt Griego Origen Sin Azúcar  5.3 Onz.,RD$89.95,Supermercado > Lácteos
Yogurt Griego De Vainilla Origen 5.3Onz.,RD$89.95,Supermercado > Lácteos
Yogurt Griego De Fresa Origen 5.3Onz.,RD$89.95,Supermercado > Lácteos
Yogurt Griego Con Melocotón Yoka 150 Gr.,RD$89.95,Supermercado > Lácteos
Yogurt Bebible Sabor Ponche Lider 32 Onz.,RD$109.95,Supermercado > Lácteos
Crema  Para Montar Asturiana 1 Lt,RD$399.95,Supermercado > Lácteos
Leche Evaporada Carnation 6Pack 312g,RD$344.95,Supermercado > Lácteos
Mantequilla De Almendra Sin Gluten Eva 200 Gr,RD$524.95,Supermercado > Lácteos
Yogurt Griego Plain Oikos 32 Onz,RD$699.95,Supermercado > Lácteos
Yogurt Griego Sabor Vainilla Light+Fit 5.3 Onz,RD$199.95,Supermercado > Lácteos
Yogurt Griego Sabor Fresa Oikos Pro 5.3 Onz.,RD$214.95,Supermercado > Lácteos
Yogurt Griego Vainilla Oikos Pro 5.3 Onz.,RD$214.95,Supermercado > Lácteos
Yogurt Sabor Melocotón Light+Fit 5.3 Onz,RD$109.95,Supermercado > Lácteos
Yogurt Sabor Blueberry Light+Fit 5.3 Onz,RD$109.95,Supermercado > Lácteos
Crema Agria Light Daisy 16 Onz,RD$399.95,Supermercado > Lácteos
Crema Agria Daisy 14 Onz,RD$299.95,Supermercado > Lácteos
Leche En Polvo  Sin Azúcar Milex Kinder Bueno 2000 Gr.,"RD$1,774.95",Supermercado > Lácteos
Fórmula en Polvo Avanzada Alacta Kids  1500 Gr,"RD$1,883.95",Supermercado > Lácteos
Fórmula en Polvo Avanzada Alacta Kids 800 Gr,"RD$1,116.95",Supermercado > Lácteos
Fórmula en Polvo Alacta Advance 1500 Gr,"RD$2,353.95",Supermercado > Lácteos
Fórmula en Polvo Alacta Advance 800 Gr,"RD$1,393.95",Supermercado > Lácteos
Leche En Polvo Sin Azúcar Milex Kinder Bueno 800 Gr.,RD$778.95,Supermercado > Lácteos
Margarina en Barra Blue Bonnet 16 Onz,RD$189.95,Supermercado > Lácteos
Leche de Soya Nutra Junior 400 Gr,RD$468.95,Supermercado > Lácteos
Leche Sabor Vainilla Parmalat 330 Ml,RD$48.95,Supermercado > Lácteos
Yogurt Sabor Vainilla Con M&Ms Yo-Crunch 4 Und/Paq 4 Onz,RD$339.95,Supermercado > Lácteos
Yogurt Griego Con Coco Yoka 150 Gr.,RD$89.95,Supermercado > Lácteos
Yogurt Griego Con Fresa Yoka 150 Gr.,RD$89.95,Supermercado > Lácteos
Yogurt De Vainilla Con Oreo Yo-Crunch 4 Und/Paq 4 Onz,RD$339.95,Supermercado > Lácteos
Queso Mozzarella Cornershop Lb (Peso Aprox. 1 Libra),RD$229.95,Supermercado > Quesos
AGREGAR A LISTA,Precio no disponible,Supermercado > Quesos
Queso Americano Pepearjack Corneshop  Lb (Peso Aprox. 1 Libra),RD$329.95,Supermercado > Quesos
Queso Cheddar Mild Cornershop Lb (Peso Aprox. 1 Libra),RD$278.95,Supermercado > Quesos
Queso Americano Colby Jack Lb (Peso Aprox. 1 Libra),RD$339.95,Supermercado > Quesos
Queso Americano Monterey Jack Cornershop Lb (Peso Aprox. 1 libra),RD$308.95,Supermercado > Quesos
Queso Americano Colby Cornershop Lb (Peso Aprox. 1 Libra),RD$339.95,Supermercado > Quesos
Queso Duro Gran Moravia 200 Gr.,RD$248.95,Supermercado > Quesos
Tabla Variada De Quesos Food Club 16 Onz.,RD$449.95,Supermercado > Quesos
Queso De Cabra Con Trufas Galeon 200 Gr.,RD$448.95,Supermercado > Quesos
Queso De Cabra Al Vino Galeon 200 Gr.,RD$378.95,Supermercado > Quesos
Queso De Cabra Y Romero Semi Curado Galeon 200 Gr.,RD$378.95,Supermercado > Quesos
Queso De Cabra Chevre Galeon 100 Gr.,RD$138.95,Supermercado > Quesos
Tapas De Queso De Cabra Semi Curado Galeon 200 Gr.,RD$338.95,Supermercado > Quesos
Queso De Cabra Semi Curado Galeon 200 Gr.,RD$378.95,Supermercado > Quesos
Tapas De Queso De Oveja Galeon 200 Gr.,RD$378.95,Supermercado > Quesos
Queso De Oveja Curado Galeon 200 Gr.,RD$349.95,Supermercado > Quesos
Queso Iberico Semi Curado Galeon 200 Gr.,RD$299.95,Supermercado > Quesos
Queso Curado Galeon 200 Gr.,RD$249.95,Supermercado > Quesos
Queso Semi Curado Sin Lactosa Galeon 200 Gr.,RD$229.95,Supermercado > Quesos
"Queso de Hoja San Juan, Und",RD$239.95,Supermercado > Quesos
Queso Crema Lider 12 Onz,RD$184.95,Supermercado > Quesos
Queso Americano Aerosol  Food Club 8 Onz,RD$269.95,Supermercado > Quesos
Queso Cheddar En Barra That´s Smart 8 Onz,RD$138.95,Supermercado > Quesos
"Queso Cheddar Imitación Importado, Lb",RD$228.95,Supermercado > Quesos
Queso Cottage 2% Bajo en Grasa Daisy 16 Onz,RD$299.95,Supermercado > Quesos
Queso Cottage Clásico 4% Daisy 16 Onz,RD$299.95,Supermercado > Quesos
Queso Bellavitano Ajo y Hierbas Sartori 150 Gr,RD$449.95,Supermercado > Quesos
Queso Merlot Bella Vitano Sartori 150 Gr,RD$449.95,Supermercado > Quesos
Queso Expresso Bella Vitano Satori 150 Gr,RD$449.95,Supermercado > Quesos
Queso Curado Gran Capitan 250 Gr,RD$459.95,Supermercado > Quesos
Huevos Blancos Grandes Norteño 15 Und/Paq,RD$134.95,Supermercado > Huevos
AGREGAR A LISTA,Precio no disponible,Supermercado > Huevos
Huevos Blancos XL Norteño 20 Und/Paq,RD$179.95,Supermercado > Huevos
Huevos Blancos Grandes Norteño 30 Und/Paq,RD$249.95,Supermercado > Huevos
